document_id,content
229,"This is similar to the pregnancy period of a woman,  which is closer to around 9 months o … r ~260 days.    However, actual gestation period of a cow can range from 270 days  to 295 days, depending primarily on breed[s], age, body condition  and nutritional health. Length of gestation is primarily an  inherited trait, but has nothing to do with the rate of maturity of  a certain breed or an individual animal."
230,Below you will find the gestation chart for your use in determining due dates for beef cattle. Just simply select the date you bred the cow to find the expected calving date. Chart is based on 283 days of pregnancy. Click here to download the table. 
231,"This is similar to the pregnancy period of a woman, which is closer to around 9 months or ~260 days. However, actual gestation period of a cow can range from 270 days to 295 days, depending primarily on breed[s], age, body condition and nutritional health. Gestation period is also controlled by genetics, but not rate of maturity. However, actual gestation period of a cow can range from 270 days  to 295 days, depending primarily on breed[s], age, body condition  and nutritional health. Length of gestation is primarily an  inherited trait, but has nothing to do with the rate of maturity of  a certain breed or an individual animal."
232,"Question: What is the gestation period and reproductive life span of cattle? Answer: The gestation period of cattle is 283 days. Cows are first mated at 15 months and are most sexually active, and therefore most fertile, from ages 2 to 6 years. "
233,bacterial infection a less common cause of sore throat a bacterial infection can lead to strep throat peritonsillar abscess retropharyngeal abscess diphtheria epiglottitis and tonsillitis certain sexually transmitted diseases std s such as gonorrhea and chlamydia also can rarely cause a sore throat trauma injury any direct injury to the throat or neck area can lead to a sore throat sometimes a foreign body for example a bone or piece of food can cause a sore throat excessive yelling or screaming can irritate the throat and larynx also leading
234,what causes a strep throat strep throat is a disease that causes a sore throat it is contagious and can be diagnosed in children teenagers and adults strep throat is caused by a bacteria called group a beta hemolytic streptococcushe most common cause of sore throat is viral infection there are a variety of viruses that cause sore throats rhinovirus measles influenza and other viruses are sources of pharyngitis bacteria can also cause inflammation in the throat
235,throat swelling introduction throat swelling swelling of the mucus membrane lining of the throat usually due to an allergic response see detailed information below for a list of 200 causes of throat swelling symptom checker including diseases and drug side effect causesreview causes of throat swelling causes symptom checkeronditions listing medical symptoms throat swelling the following list of conditions have throat swelling or similar listed as a symptom in our database this computer generated list may be inaccurate or incomplete always seek prompt professional medical advice about the cause of any symptom
236,the most common cause of sore throat is viral infection there are a variety of viruses that cause sore throats rhinovirus measles influenza and other viruses are sources of pharyngitis bacteria can also cause inflammation in the throatsome types of bacterial infection are extremely dangerous such as diphtheria oral thrush can also create an inflammation in the throat symptoms of the sore throat the most common symptoms of sore throats include a red and swollen throa
237,infections in the nose and sinuses also can cause sore throats because mucus from the nose drains down into the throat and carries the infection with it the most dangerous throat infection is epiglottitis caused by bacteria that infect a portion of the larynx voice box and cause swelling that closes the airway it creates a severely sore throat and sometimes serious breathing difficulties it can affect the liver leading to jaundice yellow skin and eyes if also causes extreme fatigue that can last six weeks or more mono a severe illness in teenagers but less severe in children can be transmitted by saliva
238,a throat infection sometimes called pharyngitis can be either a bacterial or a viral infection leading to inflammation of the tissues of the throat that causes redness pain and swelling of the walls or structures of the throat 
239,infection swollen throat glands are often caused by infection strep throat is a common infection of the throat tissues caused by group a streptococcal bacteria common symptoms of strep throat include fever headache sore throat and tender swollen glands in the neckschool age children most frequently contract strep throat although the infection may occur in any age groupthe incidence of strep throat peaks during the winter months and ebbs during the summerommon symptoms of strep throat include fever headache sore throat and tender swollen glands in the neck 
240,bacteria strep throat is an infection caused by a particular strain of streptococcus bacteria this infection can also damage the heart valves rheumatic fever and kidneys nephritis cause scarlet fever tonsillitis pneumonia sinusitis and ear infections symptoms of strep throat often include fever greater than 101 f white draining patches on the throat and swollen or tender lymph glands in the neck tumors of the throat tongue and larynx voice box can cause a sore throat with pain radiating to the ear and or difficulty swallowing other important symptoms can include hoarseness noisy breathing a lump in the neck unexplained weight loss and or spitting up blood in the saliva or phlegm
241,conditions listing medical symptoms throat swelling the following list of conditions have throat swelling or similar listed as a symptom in our database this computer generated list may be inaccurate or incomplete always seek prompt professional medical advice about the cause of any symptom
242,Turkey eggs usually take 21 to 28 days to hatch depending on what they are incubated in like an incubator or by a hen. It also depends on how fertile it is and how it is cared … for. It usually takes closer to 28 days. + 158 others found this useful. How long does it take to hatch duck eggs? It takes 28 days for duck eggs to hatch.....and it takes 21 days for baby chicks to hatch and you can only put 12 eggs under neath a chicken..
243,"With optimum conditions such as temperature and humidity a chicken egg takes 21 days to hatch.    From when it was layed, about 20-28 days,depending on the breed. From th … e time when the egg first cracked, about one day. How long does it take to hatch duck eggs? It takes 28 days for duck eggs to hatch.....and it takes 21 days for baby chicks to hatch and you can only put 12 eggs under neath a chicken.."
244,This is called a 'brood patch'. Different birds sit on their eggs for different lengths of time. Bigger birds lay bigger eggs which take longer to hatch. Blue tits incubate their eggs for two weeks but swans sit on theirs for nearly six weeks! Most birds lay one egg a day until the eggs are all laid. Some birds lay up to 15 eggs but others lay only one. But the parent birds do not start to incubate the eggs until they are all laid. 
245,"Rating Newest Oldest. Best Answer: It varies by species..but most passerines (perching birds) take approximately 2 weeks to hatch their eggs, and usually another 2 weeks before the young leave the nest. Birds built a nest and laid eggs in my grill. I left them alone, but I think the birds abandoned the nest. I want to cook on my grill, but I want to give the little guys a chance too. How long does it usually take bird eggs to hatch. Don't know what kind of bird this is, but they're tiny eggs"
246,"Best Answer: Normal hatching takes place at around 14 -16 days for most birds that would nest in your plant pots, this time is taken from the last egg laid ,if your parent bird returned to her eggs before they were chilled, then there is a good chance of them hatching shortly. "
247,"Best Answer: You've found a robin's nest. If left undisturbed, the eggs should take about 14 days to hatch. And the baby birds will leave the nest about 14 days after they have hatched. I've attached a few useful links. Source(s): http://www.learner.org/jnorth/tm/robin/F... http://animaldiversity.ummz.umich.edu/si... http://www.backyardwildlifehabitat.info/... Nesting: Two broods of 3-5 blue-green eggs with a 12-14 day incubation period. Fledging occurs 14-16 days after hatching. The nest is a mud cup lined with soft grass and reinforced with grass and twigs. The nest is usually placed in a tree, on a ledge, or on a windowsill. http://www.bird-friends.com/BirdPage.php..."
248,Share to: It takes 28 days for duck eggs to hatch.....and it takes 21 days for baby chicks to hatch and you can only put 12 eggs under neath a chicken.. How long does it take to hatch duck eggs?
249,"Asker's rating. Report Abuse. Well, without you knowing when they are laid, it's hard to determine when they will hatch, but most birds incubate for 21 days, but it depends on the breed of the bird. The more you leave her and them alone, the better chance she won't abandon her nest. "
250,"Cancer, the sign of the great mother harmonizes with colors such as silver, pearl and emerald green. Colors that mirror the moon and its tide and also the everchanging yet eternally consistent cycles of all living organisms. Use colors represented by your Sun Sign, as they are always important for emphasizing your inner creative self; combine them with the colors of your Ascendant for added nuance, or with the moon to make your inner self more apparent to the world."
251,"Pisces-Feb 19-March 20. The colors associated with Pisces are linked with shades of Indigo, Blue and other colors of the sea. Thus, Pisces could also be linked to greens and blues and other shades of the oceans. Sea-foam green is the best color for this Zodiac sign. Each of us is also born under a particular zodiac sign or astrological sign. It is therefore but natural to correlate the sequence of colors in the visible spectrum of light with each of these astrological signs. The word Zodiac can be translated roughly as the animal belt suspended between the heaven and earth."
252,"Mentioned below are the colors according to the zodiac signs: Aries: Aries is the first zodiac sign that is fiery and movable. Mars is the ruling planet of Aries. Red color and dark red color are considered as the color of this sign. Red is the color of energy, mobility, aggressiveness and purity which is lucky for Arians. Aquarius: Aquarius is the eleventh zodiac sign. It is a fixed and airy sign that is ruled by Saturn. The stated auspicious colors for Aquarians are light blue and purple. White and bright colors are also beneficial. The colors like dark blue and green are not very lucky for the people falling under Aquarius sign."
253,"Making a strict correlation between signs and colors, we tried to find the dominating color of a sign in the system of psychological correlations in Zodiac. In the description the psychological and physical characteristic of a color is followed by the corresponding sign, planet and house, in conclusion. * * *. The definition of the color correlations to the signs of the Zodiac (and also to the planets and the houses) gives the opportunity to design the color-horoscope of the individual. It will include colors of the signs in the inner circle, colors of houses in the outer, and the spots of planets on the circumference"
254,"Ruled by Moon, this Zodiac sign is associated with soft, nurturing and receptive colors like White, Grey, Silver and Cream. This zodiac sign and its color meanings include an influence on the feminine parts of the body such as the uterus, reproductive system, breasts etc. Each of us is also born under a particular zodiac sign or astrological sign. It is therefore but natural to correlate the sequence of colors in the visible spectrum of light with each of these astrological signs. The word Zodiac can be translated roughly as the animal belt suspended between the heaven and earth."
255,"The lucky colors for Capricorn are Khaki, black and purple. Dark brown and dark green can also be considered favorable. People of Capricorn sign are adviced to stay away from red and yellow color. Aquarius: Aquarius is the eleventh zodiac sign. It is a fixed and airy sign that is ruled by Saturn. The stated auspicious colors for Aquarians are light blue and purple. White and bright colors are also beneficial. The colors like dark blue and green are not very lucky for the people falling under Aquarius sign."
256,"Since they are such wide-ranging symbols, the zodiac signs have since ancient times been related to different colors, archetypes, precious stones, minerals, foods and numerous other things. Use colors represented by your Sun Sign, as they are always important for emphasizing your inner creative self; combine them with the colors of your Ascendant for added nuance, or with the moon to make your inner self more apparent to the world."
257,"Since Venus is feminine, this zodiac sign is associated with feminine colors like Pink. Gemini-May 21-June 20. Ruled by Mercury, Gemini is associated with the cheerful shades of Yellow. Gemini is positive, uplifting but also quickening or changing. Each of us is also born under a particular zodiac sign or astrological sign. It is therefore but natural to correlate the sequence of colors in the visible spectrum of light with each of these astrological signs. The word Zodiac can be translated roughly as the animal belt suspended between the heaven and earth."
258,"All vaccines are the same price regardless of size of the cat. Rabies vaccines generally cost between $12 and $25, and the same thing for the FVRCP. I'd imagine that the FeLV vaccine is similarly priced. It won't hurt her to get all of her vaccines at the same time. At the vet they can be pretty costly almost $30 per shot, depending on the humane society has it for maybe like $13-16 a shot, and for petco you can do a package for like $41 which includes everything rabies, felv, fvrcpc, and a dewormer."
259,"This estimate is based on available data on costs associated with the vaccination of companion animals (dogs and cats), national rabies diagnostic testing, and for biologics for rabies postexposure prophylaxis (PEP) and pre-exposure prophylaxis (PreEP). However, the total expenditures on rabies accounting for associated healthcare costs, animal control measures, and time lost from work is much greater. The number of PEP treatments given in the United States each year is unknown; however, it is estimated to be about 40,000 to 50,000."
260,"Related articles: Travel Vaccinations, Travel Insurance. 1  For patients not covered by health insurance, the cost of a rabies vaccination typically includes: a consultation fee, sometimes shot administration fees, and the cost of the three required doses of vaccine for a total of $500 to $1,200. Initial treatment rabies, immune Globulin, less than 1 vial but 8 injections all around site and in both arms and thighs($26,000.00) rabies vacine ($3300.00 ea for initial and 3 subsequent shots) Miscellaneous other Dr and Er charges (3 doctors bill but newver saw a Dr.)for at grand total of over $42,000.00."
261,"The estimated public health expenditures on rabies disease diagnostics, prevention, and control in the US is $245 to $510 million annually. However, the total expenditures on rabies accounting for associated healthcare costs, animal control measures, and time lost from work is much greater. The number of PEP treatments given in the United States each year is unknown; however, it is estimated to be about 40,000 to 50,000."
262,"Although the cost varies, a course of rabies immune globulin and four doses of vaccine given over a two-week period typically exceeds $3,000. The cost per human life saved from rabies ranges from approximately $10,000 to $100 million, depending on the nature of the exposure and the probability of rabies in a region. However, the total expenditures on rabies accounting for associated healthcare costs, animal control measures, and time lost from work is much greater. The number of PEP treatments given in the United States each year is unknown; however, it is estimated to be about 40,000 to 50,000."
263,"1 For example, at the Michigan State University Travel Clinic, the cost of a rabies vaccination is at least $35 to $95 for a consultation, depending on how long it lasts; $20 for shot administration ($15 for each additional shot) and $200 each for the three required shots for a total of at least $685. Initial treatment rabies, immune Globulin, less than 1 vial but 8 injections all around site and in both arms and thighs($26,000.00) rabies vacine ($3300.00 ea for initial and 3 subsequent shots) Miscellaneous other Dr and Er charges (3 doctors bill but newver saw a Dr.)for at grand total of over $42,000.00."
264,"Each of the subsequent 3 rabies vaccinations had to be given at the hospital's infusion center at a cost of over $2200 for each one of us, every time-so, the total cost of this life-threatening escapade was over $48,000. Initial treatment rabies, immune Globulin, less than 1 vial but 8 injections all around site and in both arms and thighs($26,000.00) rabies vacine ($3300.00 ea for initial and 3 subsequent shots) Miscellaneous other Dr and Er charges (3 doctors bill but newver saw a Dr.)for at grand total of over $42,000.00."
265,"1 The average cost for dog vaccinations ranges from $20 to $150 in the first year, and from $10 to $100 per year afterward. The shots given were Limes, $20 Rabies $20 and DHLLP $10. It took 15 minutes total to stand in line, get shots and pay $50 for all 3 shots offered. Love the vet clinics."
266,"1 For patients not covered by health insurance, the cost of a rabies vaccination typically includes: a consultation fee, sometimes shot administration fees, and the cost of the three required doses of vaccine for a total of $500 to $1,200. Initial treatment rabies, immune Globulin, less than 1 vial but 8 injections all around site and in both arms and thighs($26,000.00) rabies vacine ($3300.00 ea for initial and 3 subsequent shots) Miscellaneous other Dr and Er charges (3 doctors bill but newver saw a Dr.)for at grand total of over $42,000.00."
267,"You can have your refund deposited directly to your account in 7 days or less. Select Direct Deposit and provide your banking information when Direct Deposit is offered by your tax professional or by your e-file software. If you do not select Direct Deposit, you will get a paper check in about 10 days. "
268,"Direct Deposit. If you choose direct deposit when you e-file your tax return, you can expect a federal return to take two weeks, if you file before the April deadline. Some state returns may take as long as two weeks, but some can come as early as a week after submitting the return. Save. IPGGutenbergUKLtd/iStock/Getty Images. After you e-file your tax returns, you anticipate the arrival of your refund so that you can pay bills or have some spending money. The time that it takes for a refund to arrive depends on such factors as whether you use direct deposit or elect to receive a check by mail."
269,"1 An e-filed tax return usually means a faster refund compared to a paper return. 2  The IRS issues most refunds in less than 21 days. 3  If you choose direct deposit, your refund goes directly into your bank account. 4  Combining e-file with direct deposit is the fastest way to get your refund. 1 Combining e-file with direct deposit is the fastest way to get your refund. 2  About three out of four taxpayers who file receive a tax refund. 3  Last year the average refund was about $2,700. 4  Payment options. 5  If you owe tax, you can e-file early and set an automatic payment date anytime on or before the April 15 due date"
270,"However, if you owe money and do not choose an electronic payment option, you must mail your payment with a Form IT-201-V, Payment Voucher for Income Tax Returns. Refunds. E-file with direct deposit is the fastest way to get your tax refund. You may also select the debit card refund option. If you don't select direct deposit or debit card refund options, we'll mail you a check for your refund. There are two options for e-filing your return for free: 1  If your income is $60,000 or less, you can prepare and e-file both your federal and state income tax returns at no cost through an approved e-file software provider."
271,"1 Faster refunds. 2  An e-filed tax return usually means a faster refund compared to a paper return. 3  The IRS issues most refunds in less than 21 days. 4  If you choose direct deposit, your refund goes directly into your bank account. 5  Combining e-file with direct deposit is the fastest way to get your refund. 1 Combining e-file with direct deposit is the fastest way to get your refund. 2  About three out of four taxpayers who file receive a tax refund. 3  Last year the average refund was about $2,700. 4  Payment options. 5  If you owe tax, you can e-file early and set an automatic payment date anytime on or before the April 15 due date"
272,"Confidence votes 262. Between 8-15 days if you select direct deposit into a bank account or about 4 weeks if you choose to receive an IRS check. It will be faster if you select a bank product from a tax service firm, however these tend to be extremely expensive and you will have to have decent credit to qualify. If you e-file and you have chosen direct deposit, most people will receive their refund within 5 business days. If you have chosen to receive a paper check you should add 2- … 4 business days for processing. 20 people found this useful."
273,"The length of time it takes to get a Louisiana State refund from an  e-filed return can vary. As of February 2014, the state stated  e-filed returns may take around 21 days … for processing. If you e-file and you have chosen direct deposit, most people will receive their refund within 5 business days. If you have chosen to receive a paper check you should add 2- … 4 business days for processing. 20 people found this useful."
274,"If you file a paper return, the IRS says you should allow about six weeks to receive your refund. If you file Form 8379, Injured Spouse Allocation, it could take up to 14 weeks to process your tax return. "
275,"By 2010, GLONASS had achieved 100% coverage of Russia's territory and in October 2011, the full orbital constellation of 24 satellites was restored, enabling full global coverage. The GLONASS satellites' designs have undergone several upgrades, with the latest version being GLONASS-K. GLONASS is a global satellite navigation system, providing real time position and velocity determination for military and civilian users. The satellites are located in middle circular orbit at 19,100 kilometres (11,900 mi) altitude with a 64.8 degree inclination and a period of 11 hours and 15 minutes."
276,"Some advice from my friends, the previous iPad mini comes with (Assisted GPS and GLONASS) which has good connection when using flying/aviation applicatons, where as the new iPad mini only Assisted GPS. So i need futher explaination. It stands for Assiseted GPS. The iPads with cellular have a GPS. They use WiFi and cellular to assist the GPS in locking on more quickly. The GPS is assisted by the WiFi and cellular. It will work just fine while flying. WiFi ony iPads rely on WiFi for location services."
277,"A-GPS stands for Assisted Global Positioning System. While it works on the same principles as a GPS (explained below), the difference here is that it gets the information from the satellites by using network resources e.g. mobile network, also called assistant servers. A-GPS and GPS are different navigational aids that both use information from satellites to determine their exact location on Earth. GPS stands for Global Positioning System. A GPS device communicates with 4 or more satellites to determine its exact location coordinates (latitude and longitude) anywhere on Earth."
278,"On 2 October 2011 the 24th satellite of the system, a GLONASS-M, was successfully launched from Plesetsk Cosmodrome and is now in service. This made the GLONASS constellation fully restored, for the first time since 1996. GLONASS is a global satellite navigation system, providing real time position and velocity determination for military and civilian users. The satellites are located in middle circular orbit at 19,100 kilometres (11,900 mi) altitude with a 64.8 degree inclination and a period of 11 hours and 15 minutes."
279,"Manufacturers of GPS devices say that adding GLONASS made more satellites available to them, meaning positions can be fixed more quickly and accurately, especially in built-up areas where the view to some GPS satellites is obscured by buildings. GLONASS is a global satellite navigation system, providing real time position and velocity determination for military and civilian users. The satellites are located in middle circular orbit at 19,100 kilometres (11,900 mi) altitude with a 64.8 degree inclination and a period of 11 hours and 15 minutes."
280,"A-GPS is extensively used with GPS-capable cellular phones, as its development was accelerated by the U.S. FCC 's 911 requirement to make cell phone location data available to emergency call dispatchers. 1 It can supply orbital data or almanac for the GPS satellites to the GPS receiver, enabling the GPS receiver to lock to the satellites more rapidly in some cases. 2  The network can provide precise time. 3  Mobile Station Assisted (MSA): Calculation of position by the server using information from the GPS receiver."
