document_id,content
281,"Assisted GLONASS Data. Assisted GLONASS (A-GLONASS) data are now available to GDGPS customers, to enhance the performance of GLONASS chipsets. The GLONASS navigation message, the GLONASS broadcast ephemeris and the GLONASS Almanac are redundantly provided from all three GDGPS Operations Centers (GOCs). The GLONASS navigation message, bit-by-bit, is provided as a real-time UDP binary data stream."
282,"GPS and GLONASS: similarities and differences. GPS-this is the first letters of the English words Global Positioning System, which translated into Russian means global positioning system.. Sometimes there is an inaccurate understanding of the word global. GPS-is an American global positioning system, consisting of 24 satellites, a network of ground tracking stations for them, and an unlimited number of user receivers, calculators. GPS is used to determine the user's current position on the Earth's surface or in near space."
283,Antibiotics are medicines that can kill bacteria. Doctors often use antibiotics to treat urinary tract infections (UTIs). The main symptoms of UTIs are: 1  A burning feeling when you urinate. 2  A strong urge to urinate often.
284,"Trimethoprim is an antibiotic that is used for bladder infections, marketed under the brand names Proloprim, Monotrim and Triprim. It is the most widely prescribed drug for bladder infections because few infection strains are resistant to it. You should not take trimethoprim if you are also taking dofetilide, methotrexate or cyclosporine because it can cause dangerous interactions. Nitrofurantoin is an antibiotic used to treat bladder infections and is sold under the names Macrobid and Macrodantin. It prevents bacteria from forming cell walls and limits their ability to survive and reproduce."
285,"Urinary Tract Infections (UTIs). Urinary tract infections (UTIs) are a common type of infection caused by bacteria (most often E. coli) that travel up the urethra to the bladder. A bladder infection is called cystitis. If bacterial infection spreads to the kidneys and ureters, the condition is called pyelonephritis. 1 (Sometimes lower UTI symptoms may be the only signs of kidney infection. 2  People at highest risk for such silent upper urinary tract infections include patients with diabetes, impaired immune systems, or a history of relapsing or recurring UTIs.). 3  An increased need to urinate at night."
286,"Amoxicillin. Amoxicillin is an antibiotic from the penicillin group of drugs, used for many types of infections. Ear infections, gonorrhea and pneumonia can all be cured with amoxicillin. It can be prescribed as a suspension liquid or a tablet, both to be taken orally. Nitrofurantoin is an antibiotic used to treat bladder infections and is sold under the names Macrobid and Macrodantin. It prevents bacteria from forming cell walls and limits their ability to survive and reproduce."
287,"Antibiotics also prevent UTIs. The doctor might prescribe preventive antibiotic therapy for: 1  Women who have recurrent UTIs (at least two UTIs in 6 months or three UTIs in 1 year). 2  Pregnant women who had recurrent UTIs before getting pregnant or during pregnancy. Antibiotics are effective for most UTIs. You should start to feel better within 1 to 2 days after starting antibiotics. If your symptoms get worse or you don't feel better by the third day, call your doctor. It is important to take all of the antibiotics your doctor has prescribed."
288,"Women whose infections are related to sexual activity may be given a small dose of antibiotics to take each time they have intercourse. Remember that frequently recurring bladder symptoms can sometimes be caused by other conditions, such as interstitial cystitis, and are not always the result of an infection. While being treated for a bladder infection, drink plenty of fluids to help flush any bacteria out of the bladder. A common treatment is phenazopyridine (Pyridium), which is available over the counter. This is an anesthetic for the urinary tract, but doesn’t actually treat the"
289,"After you have finished treatment, you may be asked to come in for a follow-up urine test to make sure your bladder is free of all signs of infection. People with frequently recurring bladder infections may be prescribed low daily doses of antibiotics for an additional six months or longer. While being treated for a bladder infection, drink plenty of fluids to help flush any bacteria out of the bladder. A common treatment is phenazopyridine (Pyridium), which is available over the counter. This is an anesthetic for the urinary tract, but doesn’t actually treat the infection"
290,"There is a wide variety of antibiotics to treat bladder infections. Some uncomplicated infections can be treated with just three days of medication. Some drugs and some organisms require a week or more of treatment. While being treated for a bladder infection, drink plenty of fluids to help flush any bacteria out of the bladder. A common treatment is phenazopyridine (Pyridium), which is available over the counter. This is an anesthetic for the urinary tract, but doesn’t actually treat the infection"
291,"Ask your doctor about antibiotics. Doctors prescribe a variety of antibiotics for bladder infections including amoxicillin, ampicillin and ciprofloxacin. 1  Your doctor may place you on a short regimen of antibiotics or on a longer regimen depending on the severity of the infection. "
292,"A dentist probably earns more than a pharmacist. A dentist treats patients, but a pharmacist does not. A pharmacist would be very well versed in medications, more so than dentists even though dentists prescribe drugs just like doctors. Lastly, dentists are given the courtesy title of 'Dr'."
293,"Registered nurses ($68,910) and pharmacists ($116,500) also make less than the average dentist. However, there are a few health care occupations that make salaries higher than dentists, including physicians. Average Dentist Pay vs. Other Best Jobs. With an average salary of $164,570 in 2013, dentists earn far more than most other health care workers."
294,"Salary Outlook. The median annual salary for a pharmacist was $119,280, or $57.35 per hour, in 2013. The best-paid 10 percent made $147,350, while the lowest-paid made $89,000. The best-compensated pharmacists are employed by merchandise stores"
295,"Salary Outlook. Dentists are very well compensated for the services they provide. According to the BLS, dentists earned a median salary of $146,340 in 2013. The best-paid earned more than $187,999, while the lowest-paid earned less than $72,240. Dentists who work in private offices are paid particularly well, but so are those who work alongside other health practitioners. Average Dentist Pay vs. Other Best Jobs. With an average salary of $164,570 in 2013, dentists earn far more than most other health care workers."
296,"What I know: Pharmacy: 6 years of college, good salary, flexible work hrs., fast-growing field vs. Dentistry: 7 years of college, good salary, What I want to know is: Which is harder to study? Which pays more,... show more alright, I am considering 2 careers: Either Pharmacy or Dentistry. So which one is better? What I know: Pharmacy: 6 years of college, good salary, flexible work hrs., fast-growing field vs. Dentistry: 7 years of college, good salary, What I want to know is: Which is harder to... Source(s): pharm dentist: https://biturl.im/N0yeb. Sarette · 2 months ago. Thumbs up."
297,"Average Pharmacist Pay vs. Other Best Jobs. Pharmacists have one of the highest average salaries of any of our Best Health Care Jobs, earning $116,500 in 2013. The median annual salary for a pharmacist was $119,280, or $57.35 per hour, in 2013. The best-paid 10 percent made $147,350, while the lowest-paid made $89,000. The best-compensated pharmacists are employed by merchandise stores"
298,"$85,000. Average Dental Hygienist, Pharmacist, Pharmacy Technician salaries for job postings in Yakima, WA are 9% higher than average Dental Hygienist, Pharmacist, Pharmacy Technician salaries for job postings nationwide."
299,"Read more on salaries and benefits here. The median annual salary for a pharmacist was $119,280, or $57.35 per hour, in 2013. The best-paid 10 percent made $147,350, while the lowest-paid made $89,000. The best-compensated pharmacists are employed by merchandise stores"
300,"In summary, the greenhouse effect causes the atmosphere to trap more heat energy at the Earth's surface and within the atmosphere by absorbing and re-emitting longwave energy. Of the longwave energy emitted back to space, 90% is intercepted and absorbed by greenhouse gases."
301,The greenhouse effect is a result of A. consumption and radiation of energy in the atmosphere. B. absorption and radiation of energy in the hydrosphere. C. consumption of fruits and vegetables that produce a biofuel.
302,User: The greenhouse effect is a result of A. absorption and radiation of energy in the hydrosphere. B. consumption of fruits and vegetables that produce a biofuel. C. absorption and radiation of energy in the atmosphere.
303,The greenhouse effect is the name given to the earth's atmosphere trapping greenhouse gases such as carbon dioxide and methane in the earth's atmosphere.
304,"This answer has been confirmed as correct, not copied, and helpful. The greenhouse effect is a result of A. consumption and radiation of energy in the atmosphere. B. absorption and radiation of energy in the hydrosphere. C. consumption of fruits and vegetables that produce a biofuel."
305,The greenhouse effect is a result of A. absorption and radiation of energy in the hydrosphere. B. consumption of fruits and vegetables that produce a biofuel. C. absorption and radiation of. energy in the atmosphere. D. consumption and radiation of
306,The greenhouse effect. The exchange of incoming and outgoing radiation that warms the Earth is often referred to as the greenhouse effect because a greenhouse works in much the same way. Incoming UV radiation easily passes through the glass walls of a greenhouse and is absorbed by the plants and hard surfaces inside.
307,"This variety of fast growing plant seeds, which produces flowers, was first discovered by Dr. Johann Friedrich Eschscholtz on the Pacific coast. California poppies displays lively colors and are long lasting. They are self seeding plants and can grow to about 12 to 16 inches in length. The seeds of weeping willow tree are one of the fastest growing seeds. If provided with the ideal climatic conditions, the seeds can germinate within 10 to 15 days and grows by as much as 8 to 10 feet every year. The branches are slender and narrow, and the leaves becomes rich golden in color during autumn."
308,"Young lettuce plants peeking through the soil will satisfy even the most impatient gardener. For many gardeners, waiting for seeds to germinate and plants to grow is part of the hobby's reward. For others, however, it can be maddening, especially if you are gardening with children"
309,"Bermuda grass, one of the most common fast-growing grass seeds, can grow in any climatic conditions, warm or cold. Usually grown in warm climatic conditions, this variety grows within 21 days. It is extensively used in golf courses, sports fields, pastures, coastal areas, and lawns these days. If you plant them from seeds, you should first plant them indoors about 8 weeks before the end of frost, and you would see the seeds germinating in the next 10 to 20 days. Morning Glory. The morning glory flower is known for its bright colors, like purple, red, pink, and blue."
310,"Bermuda grass, one of the most common fast growing grass seeds, can grow in any climatic conditions, whether warm or cold. Usually grown in warm climatic conditions, this variety grows within 21 days and extensively used in golf courses, sports fields, pastures, coastal areas and lawns today. The seeds of weeping willow tree are one of the fastest growing seeds. If provided with the ideal climatic conditions, the seeds can germinate within 10 to 15 days and grows by as much as 8 to 10 feet every year. The branches are slender and narrow, and the leaves becomes rich golden in color during autumn."
311,"Radishes. Radish seeds are some of the fastest-germinating seeds, generally taking between six and eight days to germinate. Because of their small size, however, the seeds can be difficult for smaller hands to work with, and the shoots are not as dramatic as some of the larger options. Selecting appropriate seeds for speedy germination is important when time is of the essence—for example, for a science fair project. In order for a seed to germinate, it must absorb a large amount of water through its outer coat."
312,"The seeds of weeping willow tree are one of the fastest growing seeds. If provided with the ideal climatic conditions, they can germinate within 10 to 15 days. The tree by as much as 8 to 10 feet every year. The branches are slender and narrow, and the leaves become rich golden in color during autumn. If you plant them from seeds, you should first plant them indoors about 8 weeks before the end of frost, and you would see the seeds germinating in the next 10 to 20 days. Morning Glory. The morning glory flower is known for its bright colors, like purple, red, pink, and blue."
313,"These plants may grow from seeds or cuttings. If you plant them from seeds, you should first plant them indoors about 8 weeks before the end of frost and you would see the seeds germinating in the next 10 to 20 days. Morning Glory. The morning glory flower is known for its bright colors, like purple, red, pink and blue. The seeds of weeping willow tree are one of the fastest growing seeds. If provided with the ideal climatic conditions, the seeds can germinate within 10 to 15 days and grows by as much as 8 to 10 feet every year. The branches are slender and narrow, and the leaves becomes rich golden in color during autumn."
314,Vigoro 3 lb. Fast Grass Lawn Seed Mix is a fast germinating mix with results in 3 to 5 days. Excellent for ground cover and erosion control. This mix can be used to quickly repair bare spots and for over-seeding a Bermuda lawn. 1  Germinates in 3 to 5 days. 
315,"This Buzzle article gives you a list of some of the fast-growing plant seeds, which you can plant in your home garden. Advertisement. For many people, it's frustrating to wait to see the plants in their garden grow. Today, most homeowners are impatient and they want the plants in the garden to grow as soon as possible. If you plant them from seeds, you should first plant them indoors about 8 weeks before the end of frost, and you would see the seeds germinating in the next 10 to 20 days. Morning Glory. The morning glory flower is known for its bright colors, like purple, red, pink, and blue."
316,"These correspond to the more common and international usage of metropolitan areas. Significant Urban Areas are similarly defined but include population centres which are not capital cities. In Australia the population of the GCCSA/SUA is the most-often quoted figure for that city's population. The following ranks GCSSAs and SUAs which are not included within the GCCSAs with populations of over 30,000. Greater Capital City Statistical Areas are in bold, the remainder are Significant Urban A"
317,"Perth is situated in Western Australia and is the largest city and capital of the state. Perth has a population of 1.8 million people living in its metropolitan area, which covers 5,386 square kilometers (2,079 square miles). The fifth largest city in Australia is Adelaide, the South Australian capital. The capital of Australia is Canberra, which is located in the Australian Capital Territory in southeastern Australia. Canberra has a population of about 367,000, making it the largest inland city in the country, but the eight largest city in all. Canberra covers an area of 814 square kilometers (314 square miles)"
318,"Brisbane is Queensland's capital, and the third largest city in Australia with a population of 2.1 million. Brisbane covers an area of 5,949 square kilometers (2,297 square miles) along the east coast of the continent. The capital of Australia is Canberra, which is located in the Australian Capital Territory in southeastern Australia. Canberra has a population of about 367,000, making it the largest inland city in the country, but the eight largest city in all. Canberra covers an area of 814 square kilometers (314 square miles)"
319,"Victoria, named after the English Queen, is Australia’s second largest state. It’s population in January 2012 was 5,574,500. It’s largest city is Melbourne, Australia’s second city, where three quarters of all Victoria ns live. If Victoria was a country, it would be Denmark. South Australia (1.6 million). South Australia, in the centre of Australia's south coast, is home to 1,645,000 people. It's largest city is its capital, Adelaide, which is home to all but 400,000 of South Australia's residents. If South Australia were a country, it would be Qatar."
320,"New South Wales is Australia’s oldest and most populated state. It was originally settled as a penal colony on the shores of Port Jackson where the bustling capital city of Sydney now stands. More than a third of Australians live in New South Wales, and Sydney is the nation’s largest city. Victoria is the smallest of the mainland states in size but the second most populated. Melbourne is the capital and is Australia’s second most populated city. During the gold rush of the 1850s, it became one of the world's largest and wealthiest cities. "
321,"Melbourne, the capital of Victoria, is the second largest city in Australia with a population of about 4.1 million. The area of Melbourne is about 8,806 square kilometers (3,400 square miles), and it is called Garden City. The capital of Australia is Canberra, which is located in the Australian Capital Territory in southeastern Australia. Canberra has a population of about 367,000, making it the largest inland city in the country, but the eight largest city in all. Canberra covers an area of 814 square kilometers (314 square miles)"
322,"The three largest cities in southeastern Australia are Sydney  (capital of New South Wales), Melbourne (capital of Victoria) and  Adelaide (capital of South Australia). It has an area of 424,400 sq km and is located in Western Australia. The second largest desert is the Great Sand … y Desert in Western Australia), with an area of 284,993 sq km. The third largest desert in Australia is the Tanami Desert which extends over part of Western Australia and the Northern Territory."
323,"While Sydney and Melbourne are by far the two biggest cities, some of the smaller state capitals are eclipsed in population by some of the larger regional centres. Here is the official list of the top 33 centres for 2010-11. "
324,"The largest city in Australia by population is Sydney, with 4,605,992 people as of the 2011 census. "
325,"1 A concrete driveway with several decorative elements can cost $12 -$18 a square foot, or $3,600 -$5,400 for 12'x25' or $11,500 -$17,500 for 24'x40'. 1 Concrete should be sealed about 20-30 days after installation, and re-sealed about every two years. 2  Do-it-yourself materials typically cost $50 -$200 or more; professional sealing can cost $150 -$500 or more."
326,"1 Also called tar and chip or oil and stone, macadam driveway can cost $1 -$3 or more a square foot on an existing driveway, or $600 -$1,800 for 12'x50'; and $2 -$4 or more a square foot for a completely new driveway with gravel base, or $1,200 -$2,400 for 12'x50'. 1 A stamped asphalt pattern (typically in the shape of bricks or stones) on a new or existing asphalt driveway can cost $3 -$9 a square foot, or $900 -$2,700 for 12'x25' or $3,600 -$11,000 for 24'x50' for just the stamping."
327,"1 A CostHelper reader in Virginia paid $10,255 for 903 square feet with a broom finish, or $11.36 per square foot. 2  A concrete driveway with several decorative elements can cost $12 -$18 a square foot, or $3,600 -$5,400 for 12'x25' or $11,500 -$17,500 for 24'x40'. 1 Concrete should be sealed about 20-30 days after installation, and re-sealed about every two years. 2  Do-it-yourself materials typically cost $50 -$200 or more; professional sealing can cost $150 -$500 or more."
328,"1 Macadam typically lasts 6-10 years and provides the decorative and rustic appearance of a gravel driveway but with a firm base. 2  An asphalt driveway costs about $2 -$5 a square foot, or $1,200 -$3,000 for 12'x50' to $31,000 -$75,000 for a 12' lane a quarter mile long. 1 A stamped asphalt pattern (typically in the shape of bricks or stones) on a new or existing asphalt driveway can cost $3 -$9 a square foot, or $900 -$2,700 for 12'x25' or $3,600 -$11,000 for 24'x50' for just the stamping."
329,"1 Resurfacing an existing concrete driveway typically costs $2 -$8 a square foot depending on the thickness of the resurfacing layer, the condition of the existing concrete, and whether there are any patterns or colors stamped on the resurfaced area. 1 Concrete should be sealed about 20-30 days after installation, and re-sealed about every two years. 2  Do-it-yourself materials typically cost $50 -$200 or more; professional sealing can cost $150 -$500 or more."
330,"1 A plain concrete driveway can cost $3 -$10 or more a square foot, or $900 -$3,000 for 12'x25' or $2,900 -$9,600 for 24'x40', while a customized concrete driveway with multiple decorative elements can cost $15 -$25 or more a square foot, or $4,500 -$7,500 for 12'x25' or $14,400 -$24,000 for 24'x40'). 1 A stamped asphalt pattern (typically in the shape of bricks or stones) on a new or existing asphalt driveway can cost $3 -$9 a square foot, or $900 -$2,700 for 12'x25' or $3,600 -$11,000 for 24'x50' for just the stamping."
331,"1 A gravel driveway starts at roughly $0.75 -$3 or more a square foot, or $300 -$1,000 for a 12'x25' single-car driveway. 2  Costs can double for a roadway-quality driveway. 3  Loose gravel will need replenishing periodically, but a correctly designed, installed and maintained gravel driveway can last 50-100 years or more. 1 A stamped asphalt pattern (typically in the shape of bricks or stones) on a new or existing asphalt driveway can cost $3 -$9 a square foot, or $900 -$2,700 for 12'x25' or $3,600 -$11,000 for 24'x50' for just the stamping."
332,"The cost to pave an average concrete driveway varies by location, shape, size, concrete reinforcement material, labor rates, and decorative quality of the finish. A typical two-car driveway is 16 feet wide and 38 feet long without curves or slope, for a total surface area of 610 square feet. It will typically cost $4.99 per square foot to be professionally supplied and paved with concrete. The DIY Material Cost is around $2.59 per square foot. 1 Decorative effects in concrete are available and include colored concrete for an average cost of $40 per cubic yard ($260 in this example) and embossed concrete for average cost of $1.70 per square foot ($1,037 in this example)."
333,"The average national cost of a driveway installation is $3,647, with most homeowners spending between $2,026 and $5,278. This data is based on actual project costs as reported by HomeAdvisor members. If you're thinking about installing a driveway, it's important to consider a couple of different things. 1 Pros: costs less than concrete (about $3 to $4 per square foot), easy repairs, dries faster for immediate use, adapts to different temperature changes, lasts about 20 years. 2  Cons: only comes in black, less durable, requires resealing every 3-5 years and resurfacing regularly."
334,"Crotalus horridus. Photo by Lisa Powers. Description: Typical timber rattlesnakes measure anywhere from 36-58 inches (91-147 cm) in length with Klauber (1956) reporting the largest timber rattlesnake ever recorded to be 74 inches (189.23 cm) collected near New Orleans, LA in the 1940 s. Originally found in 30 states, it has been extirpated from Delaware, Maine, and Rhode Island. The species is listed as endangered in Massachusetts, New Hampshire, New Jersey, Ohio, Texas, Vermont, and Virginia and threatened in Illinois, Indiana, Minnesota, New York, and Texas. Timber rattlesnakes are protected in Kansas, Maryland, Oklahoma, Pennsylvania, and Wisconsin"
335,"Rattlesnakes are a group of venomous snakes of the genera Crotalus and Sistrurus of the subfamily Crotalinae (pit vipers). The 36 known species of rattlesnakes have between 65 and 70 subspecies, all native to the Americas, ranging from southern Alberta and southern British Columbia in Canada to Central Argentina. Rattlesnakes are predators that live in a wide array of habitats, hunting small animals such as birds and rodents."
336,"The timber rattlesnake occurs in the eastern and central United States. Minnesota is on the northwestern periphery of its range, which extends north along the Mississippi River from Illinois to Minnesota. Surveys for timber rattlesnakes in Minnesota have been funded and coordinated by a collaborative effort of the Minnesota DNR Nongame Wildlife Program (NWP), Division of Parks, and Minnesota Biological Survey for almost 20 years. Formal surveys began in 1990-1991 at 6 southeastern Minnesota State Parks."
337,"Description. Measuring from 3-4.5 feet (91-137 cm) or more in length, the timber rattlesnake is the largest venomous snake in New York. The record length is 74 ½ inches (189 cm). Timber rattlers impress one as being very stocky; they are large snakes. Despite their size, cryptic coloration allows them to be easily concealed"
