document_id,content
0,"The first standing Committee of Correspondence was formed by Samuel Adams and twenty other Patriot leaders in November of 1772 in Boston in response to the Gaspee Gaspée, affair which had occurred the Previous june in the colony Of Rhode. island In late 1773, the Boston Committee of Correspondence was charged with managing the “tea crisis” and was the driving force of the December 16, 1773, Boston Tea Party, which was carried out by the Sons of Liberty."
1,"The first communication from the Boston Committee of Correspondence sent to the towns of Massachusetts was a list of grievances (below) they had with Britain with a request that their views be endorsed. In Boston on Monday, November 2, 1772, they organized a town meeting at Faneuil Hall and garnered enough support to vote in a resolution to create a standing Committee of Correspondence."
2,"The Boston Committee of Correspondence was formed at the Boston Town Meeting of November 2, 1772 in response to the British government’s decision to pay the governor and Superior Court judges of Massachusetts with Crown stipends, thereby making them dependent on the Crown rather than the people in assembly. With the gradual establishment of self-government and the evacuation of the British from Boston in March 1776, the Committee of Correspondence attended to public safety activities in the Boston area until the end of the Revolutionary War."
3,"Circular Letter of the Boston Committee of Correspondence; May 13, 1774. We have just received the copy of an Act of the British Parliament passed in the present session whereby the town of Boston is treated in a manner the most ignominious, cruel, and unjust. "
4,"The Boston Committee of Correspondence records, dated 1772-1784, document the Committee’s initiatives in colonial political action in Massachusetts, from the writing of the Boston Pamphlet in November 1772 through the early months of war with Great Britain in 1775, as well as the Committee's contact with other colonies. With the gradual establishment of self-government and the evacuation of the British from Boston in March 1776, the Committee of Correspondence attended to public safety activities in the Boston area until the end of the Revolutionary War."
5,"The first standing Committee of Correspondence was formed by Samuel Adams and twenty other Patriot leaders in November of 1772 in Boston in response to the Gaspee Gaspée, affair which had occurred the Previous june in the colony Of Rhode. Island Samuel adams. portrait In late 1773, the Boston Committee of Correspondence was charged with managing the “tea crisis” and was the driving force of the December 16, 1773, Boston Tea Party, which was carried out by the Sons of Liberty."
6,"In late 1773, the Boston Committee of Correspondence was charged with managing the “tea crisis” and was the driving force of the December 16, 1773 Boston Tea Party…. These Committees of Correspondence were intercolonial standing provincial governments. In late 1773, the Boston Committee of Correspondence was charged with managing the “tea crisis” and was the driving force of the December 16, 1773, Boston Tea Party, which was carried out by the Sons of Liberty."
7,"This report of the Boston Committee of Correspondence was prepared by Sam Adams and read to the Boston Town Meeting on Nov. 20, 1772. The inflammatory piece, written by the known radical and master propagandist, is a window looking into Revolutionary Boston four years before the Declaration of Independence. For example the Committee of Correspondence in Boston gave its blessing on the raiding of the Dartmouth and the destruction of its cargo that became known as the Boston Tea Party. As the revolution drew nearer, the committees became the spine of colonial interaction."
8,"The Boston Committee of Correspondence was the driving force of the December 16, 1773, Boston Tea Party, which was carried out by the Sons of Liberty. Samuel Adams was the prominent leader of both organizations. In late 1773, the Boston Committee of Correspondence was charged with managing the “tea crisis” and was the driving force of the December 16, 1773, Boston Tea Party, which was carried out by the Sons of Liberty."
9,"Kidney stones may cause cloudy urine. They can cause pus in the urine, which gives your pee that milky or cloudy look. If you have kidney stones, the pain of the stones may lead you to see a doctor more quickly than the cloudy urine. Some possible cloudy urine causes are: Food can cause a change in the consistency and color of your urine, although they are not the usual cause of cloudy urine. Blood in urine-When the blood is microscopic, it may not show bright red or dark red but rather it may appear as cloudy urine."
10,"A urinary tract infection-a UTI can cause cloudy urine. The urinary tract infection may be accompanied with burning or painful urination. A bladder infection (a more specific type of urinary tract infection), also known as Cystitis, may cause cloudy urine. Some possible cloudy urine causes are: Food can cause a change in the consistency and color of your urine, although they are not the usual cause of cloudy urine. Blood in urine-When the blood is microscopic, it may not show bright red or dark red but rather it may appear as cloudy urine."
11,"Normal urine is clear and has a straw-yellow color. When the urine does not have its characteristic clear appearance, it is often referred to as cloudy, turbid, or foamy urine. Cloudy or foamy urine may occur occasionally due to mild dehydration; when it occurs in the absence of symptoms and goes away rapidly, it is usually of little consequence. Certain conditions can cause excess protein or crystalline substances in the urine, causing it to persistently appear cloudy or foamy. Infections anywhere in the urinary tract can cause blood and pus to appear in the urine, giving it a cloudy appearance. Additionally, many of the numerous causes of blood in the urine can yield a cloudy or murky appearance to the urine due to the presence of blood"
12,"Best Answer: Yellow is NOT a normal color, nor is cloudiness normal. If your urine is yellow, you're dehydrated. The normal color should be clear or perhaps the color of lemonade (just a slight hint of yellow that can't be seen easily). This is a serious condition. The medical community either overlooks the signs of dehydration or else ignores them completely."
13,"Healthy urine is clear and light yellow in color. Urine may appear cloudy for a variety of reasons, some of which are not harmful, such as foaming of the urine that occurs temporarily when urinating rapidly."
14,"Cloudy urine can be caused by a variety of conditions, including vaginal discharge, sexually transmitted diseases, dehydration, certain autoimmune disorders, as well as infection, inflammation, or other conditions of the urinary tract (kidneys, ureters, bladder and urethra). Urine may appear cloudy for a variety of reasons, some of which are not harmful, such as foaming of the urine that occurs temporarily when urinating rapidly."
15,Cloudy urine with strong odor. WebMD Symptom Checker helps you find the most common symptom combinations and medical conditions related to cloudy urine with strong odor. Click on the combination that matches your symptoms to find the conditions that may cause these problems.
16,"If your cloudy urine is caused by a urinary tract infection, or bladder infection, it is usually treated by simple antibiotics and clears up within a couple of weeks. If your cloudy urine is caused by a kidney stone… you’ll usually know it, as the pain can be pretty intense. Some possible cloudy urine causes are: Food can cause a change in the consistency and color of your urine, although they are not the usual cause of cloudy urine. Blood in urine-When the blood is microscopic, it may not show bright red or dark red but rather it may appear as cloudy urine."
17,"There are a variety of cloudy urine causes. If your urine color is cloudy or looks like milky urine, it could be nothing to worry about … or it could be a sign of a serious illness. Keep in mind that cloudy urine is a symptom and not an illness by itself. Some possible cloudy urine causes are: Food can cause a change in the consistency and color of your urine, although they are not the usual cause of cloudy urine. Blood in urine-When the blood is microscopic, it may not show bright red or dark red but rather it may appear as cloudy urine."
18,"Blood tests will show if your ANCA test is positive or negative. If positive, it shows if there are PR3 or MPO, and it also shows the titer level. The titer shows how high the ANCA level in your blood is. The confusing thing is that not all CSS patients are ANCA positive. According to Prof. dr. Loic Guillevin only one third to one half of all CSS patients are ANCA positive-mostly MPO positive, sometimes PR3, sometimes both."
19,"Bottom right-MPO antibodies on formalin-fixed neutrophils (c-ANCA pattern).(FITC conjugate). Anti-neutrophil cytoplasmic antibodies (ANCAs) are a group of autoantibodies, mainly of the IgG type, against antigens in the cytoplasm of neutrophil granulocytes (the most common type of white blood cell) and monocytes. "
20,"Tests for antineutrophil cytoplasmic antibodies (ANCA) may be used to: 1  Help detect and diagnose certain forms of autoimmune vasculitis, including granulomatosis with polyangiitis (Wegener granulomatosis), microscopic polyangiitis, and eosinophilic granulomatosis with polyangiitis (Churg Strauss syndrome). Positive ANCA, PR3, and/or MPO tests help to support a diagnosis of systemic autoimmune vasculitis and to distinguish between different types. However, to confirm a diagnosis, a biopsy of an affected site is often required."
21,"Two types of tests may be used: 1  Most often, ANCA tests are performed using indirect immunofluorescence microscopy (IFA). 2  Myeloperoxidase antibodies and proteinase 3 (PR3) antibodies may be individually and specifically tested using an immunoassay method. Positive ANCA, PR3, and/or MPO tests help to support a diagnosis of systemic autoimmune vasculitis and to distinguish between different types. However, to confirm a diagnosis, a biopsy of an affected site is often required."
22,"No, some patients can be ANCA positive and others ANCA negative. Individual patients may be positive at one blood test and negative at another. The physician uses the ANCA test as a guide to treatment, along with other test results and by examination and discussion with the patient. Anti-neutrophil-cytoplasmic antibody. In ANCA associated vasculitis the B-cells produce antibodies that are directed against proteins found on the surface of neutrophils (a type of white blood cell)."
23,"In addition, tests that are specific for antibodies to MPO and PR3 may be performed: 1  A positive test for PR3 antibodies and a positive cANCA or pANCA are seen in more than 80% of patients with active granulomatosis with polyangiitis (Wegener granulomatosis). Positive ANCA, PR3, and/or MPO tests help to support a diagnosis of systemic autoimmune vasculitis and to distinguish between different types. However, to confirm a diagnosis, a biopsy of an affected site is often required."
24,"Negative ANCA tests results mean it is unlikely that a person's symptoms are due to an autoimmune vasculitis. For a positive result on the indirect immunofluorescence microscopy method, several different ANCA patterns may be seen: 1  Perinuclear (pANCA) – most of the fluorescence occurs near the nucleus. Positive ANCA, PR3, and/or MPO tests help to support a diagnosis of systemic autoimmune vasculitis and to distinguish between different types. However, to confirm a diagnosis, a biopsy of an affected site is often required."
25,"Atypical P-ANCA Titer. Testing for anti-neutrophil cytoplasmic antibodies (P-ANCA and/or C-ANCA and/or atypical P-ANCA) has been found to be useful in establishing the diagnosis of suspected vascular diseases, inflammatory bowel disease, as well as other autoimmune diseases. Clinical Significance. Testing for anti-neutrophil cytoplasmic antibodies (P-ANCA and/or C-ANCA and/or atypical P-ANCA) has been found to be useful in establishing the diagnosis of suspected vascular diseases, inflammatory bowel disease, as well as other autoimmune diseases."
26,"Smoke Smell Removal. There’s something about vinegar that gets rid of smoke smell. Because the smell of smoke is caused by the leftover resins and tars, vinegar (an acid that cuts through resin and tar) is a great way to clean those surfaces that aren’t made of fabric, and perhaps, some that are fabric. If it doesn’t have a cleaning agent in it, you’re not going to get rid of the smoke smell. Scent-generating deodorizers only serve to mask the smell. Once you take them out of the house, you’ll notice the smell of old cigarettes again. Of course, we’ve all heard of Febreze, and wonder why it works."
27,"Cigarette and cigar smoke penetrates furniture, carpets, walls, windows, painted surfaces, and just about every other nook and cranny in our homes. Smoking in a home leaves a tar residue on everything in the home. the best way to get rid of the smell is to get rid of the tar residue. 1 Try sprinkling baking soda on the carpets to soak up the odor. 2  Devise a system that pulls the smoky air outside of your home so it doesn't have time to set on your surroundings such as smoking in front of an extractor fan that is set to expel air from the room."
28,"Removing Cigarette Odors from the Car: Fresh air will work wonders. You can shampoo the floor mats, carpet and upholstery. Use Windex and clean the inside windows and use the appropriate cleaning solution to clean the dash board and seats. It's one of the best gifts you can give to yourself. One of best ways to stay quit is to spend a few hours removing the odor of cigarette smoke. Once you realize how much better your home, clothes and car smell without that stinky odor, you'll never want another cigarette again. Your first task: Throw away the ashtrays."
29,"Use scented baking soda if you like. Shades, curtains, and fixtures need to be cleaned to get rid of smoke odor. A lot of people forget to clean things like shades, chandeliers, curtains, and wall hangings, but these things have probably collected quite a bit of tar and resin from years of hanging smoke. If it doesn’t have a cleaning agent in it, you’re not going to get rid of the smoke smell. Scent-generating deodorizers only serve to mask the smell. Once you take them out of the house, you’ll notice the smell of old cigarettes again. Of course, we’ve all heard of Febreze, and wonder why it works."
30,"Thankfully, there are appropriate solutions that you can use to deal with smoke odor. Specifically, there are ingredients found around your home or garden that you can use to get rid of smoke odor. The irritating scent will be gone in no time if you know how to use these homemade solutions. You can place apple cider vinegar or just conventional white vinegar in a bowl. Put it in the corners around your home or any space where the pesky smoke odor lingers. Vinegar is a good agent to remove almost any awful scent. Trust old, faithful vinegar-cider or white vinegar."
31,"The Ammonia Method. Ammonia can also remove cigarette tar and nicotine from walls when mixed with water. Combine a tablespoon of ammonia for every cup of water, or roughly 1/2 cup of ammonia to a gallon of warm water. For painted walls, reduce the mixture to 1/4 cup to a gallon of water"
32,"I have a stale smell of fire smoke left in my sitting room and I can't get rid of the smell. Clean the hard surfaces and walls thoroughly with 1 gallon of water, 4 tablespoons of baking soda and a few drops of dish detergent. Shampoo the carpet, or sprinkle it with baking soda, let it sit for an hour, then vacuum. You can place apple cider vinegar or just conventional white vinegar in a bowl. Put it in the corners around your home or any space where the pesky smoke odor lingers. Vinegar is a good agent to remove almost any awful scent. Trust old, faithful vinegar-cider or white vinegar."
33,"1 An ozone generator will, apparently, get rid of any odor you can think of if it's left on long enough in a closed house or apartment. 2  For a quick fix to a tobacco smell which is not too engrained try placing a pot filled with water in your oven and put about five or six drops of vanilla essence into the water. 1 Try sprinkling baking soda on the carpets to soak up the odor. 2  Devise a system that pulls the smoky air outside of your home so it doesn't have time to set on your surroundings such as smoking in front of an extractor fan that is set to expel air from the room."
34,"All of these solutions can remove the cigarette stink from the walls, but the smell may linger inside the home and recontaminate the walls if you forget to clean the filters for the home's HVAC system. As you clean the walls, ventilate the house thoroughly. Ammonia can also remove cigarette tar and nicotine from walls when mixed with water. Combine a tablespoon of ammonia for every cup of water, or roughly 1/2 cup of ammonia to a gallon of warm water."
35,How to remove cigarette odor from a car. Step No 4. Extract the residues (hot water and smoke odor control product) with your wet vac (I use the small wand for this as shown below). get rid of smoke smell get rid of smoke smell. Step No 5. Finish with very hot water again and leave to dry. 
36,"A stroke is caused by a disturbance of the blood supply to the brain. The blood vessels that normally supply blood to the brain can be compromised by becoming blocked or bleeding.Both scalp and body acupuncture are techniques that can be used to aid recovery from a stroke. Nerve Paralysis. Chinese research workers claim that acupuncture can be used to treat the symptoms of spina bifida, such as incontinence, although no claim has been made that acupuncture can affect the anatomical abnormality."
37,"Once a clear diagnosis has been made acupuncture can usually be used to relieve this type of pain. Many of these 'acute pains' represent a self-limiting disease process; for instance a small burn is usually excruciatingly painful for a few days and then settles. Nerve Paralysis. Chinese research workers claim that acupuncture can be used to treat the symptoms of spina bifida, such as incontinence, although no claim has been made that acupuncture can affect the anatomical abnormality."
38,"Once a clear diagnosis has been made acupuncture can usually be used to relieve this type of pain. Many of these 'acute pains' represent a self-limiting disease process; for instance a small burn is usually excruciatingly painful for a few days and then settles. Some of this work is excellent but, for a variety of technical reasons, some is poor. Clinical trials have been completed on knee, hip, elbow, neck and lower back pain, and the information from these trials shows that significant pain relief can be achieved in about 70 per cent of those who receive acupuncture."
39,"Acupuncture is one of the oldest, most commonly used medical procedures in the world. Research shows that acupuncture is beneficial in treating a variety of health conditions. The term acupuncture describes a family of procedures involving stimulation of anatomical points on the body by a variety of techniques. Nerve Paralysis. Chinese research workers claim that acupuncture can be used to treat the symptoms of spina bifida, such as incontinence, although no claim has been made that acupuncture can affect the anatomical abnormality."
40,"Research work by Chinese physiologists has shown, quite clearly, that acupuncture can reduce the acidity of the stomach and this may be one of the mechanisms by which acupuncture heals stomach ulcers and other digestive diseases. Nerve Paralysis. Chinese research workers claim that acupuncture can be used to treat the symptoms of spina bifida, such as incontinence, although no claim has been made that acupuncture can affect the anatomical abnormality."
41,"Acupuncture is a component of the health care system of China that can be traced back at least 2,500 years. The general theory of acupuncture is based on the premise that there are patterns of energy flow (Qi) through the body that are essential for health. Disruptions of this flow are believed to be responsible for disease."
42,"Acupuncture is a 3,000-year-old healing technique of Traditional Chinese Medicine. In 1997, the U.S. National Institutes of Health (NIH) documented and publicized acupuncture’s safety and efficacy for treating a wide range of conditions. By stimulating the body’s various systems, acupuncture can help to resolve pain, and improve sleep, digestive function, and sense of well-being."
43,"All of these patterns of visual impairment can be helped through Chinese medicine by correcting the imbalance through acupuncture and lifestyle changes. In order to have great results with this problem, it’s always good to recognize any vision problems early on before the problems fully develop. "
44,"Acupuncture is a typical Chinese medicine treatment method which treats internal diseases through external methods. Clinically, the doctor will firstly examine the patients, ascertain the key of treatment, which channels are lesioned, whether the disease property is cold or hot, and make a diagnosis of the disease. Acupuncture is a way to unblock or influence chi and help it flow back into balance. Acupuncture is done by manipulating thin, solid needles that have been inserted into acupuncture points in the skin. Sometimes heat, pressure or mild electrical current is used along with needles to treat diseases."
45,"therefore it's a good idea to use [math.h]. and in general, for such header pairs, to use the [.h] version. I would disagree. The only reason the .h versions exist is for compatibility. The C headers are listed under [depr.c.headers] for a reason. 9. @Jesse: the argument goes that if you include math.h, then you know you're dropping a heap of junk in your global namespace. If you include cmath then you may or may not be dropping a heap of junk in your global namespace."
46,"They are C++ standard library headers. The headers are headers defined by the C standard library: The C++ standard library also makes available the facilities of the C standard library, suitably adjusted to ensure static type safety. The C++ headers, for the most part, have content identical to the corresponding C library headers except that the names are all defined in the std namespace. If those answers do not fully address your question, please ask a new question. The marked duplicate precisely answers your question. – Alok Save Mar 27 '13 at 10:55. Possibly more pertinent duplicate than those already listed: stackoverflow.com/questions/8734230/… – Chris White Dec 9 '13 at 2:14. @ChrisWhite: indeed."
47,"2. I've seen some information about differences between things like iostream vs iostream.h. From what I gathered from those the difference between them is that the version without the .h extension will not populate the namespace while the version with the extension will. 9. @Jesse: the argument goes that if you include math.h, then you know you're dropping a heap of junk in your global namespace. If you include cmath then you may or may not be dropping a heap of junk in your global namespace."
48,"Overview over the Functions of CMATH. In C++ and Delphi, synonyms are defined for all these functions. The synonyms do not have a prefix, since the data type information is implicitly handled by the compiler. Only in the following cases, the conversion really makes sense: 1  You have only multiplications and related math functions (like square, sqrt, ipow). 2  You have to call the complex exponential function. 3  You are in polar coordinates and have to calculate the logarithm."
49,"Square Root (The sqrt Function). C++ cmath library includes a square root function, which has the signature: double sqrt (double x); . That is, it calculates and returns the square root of x as a double value. If the function is called with an integer argument, the C++ compiler will convert it to a double before calling the function. The notation for division in mathematical formulas is similar to the operator used in C++. For example, the formula P/T is converted to C++ as P/T or as pressure / temperature. But what about a formula like this:"
50,Basically I have to raise a power. I'm using the volume formula V=pi*r^2*h. I already declared PI using #declare PI 3.141592. But I just learned I cannot simply do (radius)^2 in C++ rather there's a power function pow() I have to do (around those terms not done fully learning it yet). 
51,"I've seen some information about differences between things like iostream vs iostream.h. I've seen some information about differences between things like iostream vs iostream.h. [iostream.h] is not a standard header. 9. @Jesse: the argument goes that if you include math.h, then you know you're dropping a heap of junk in your global namespace. If you include cmath then you may or may not be dropping a heap of junk in your global namespace."
