document_id,content
118,"Most ocean pollution begins on land. When large tracts of land are plowed, the exposed soil can erode during rainstorms. Much of this runoff flows to the sea, carrying with it agricultural fertilizers and pesticides. Eighty percent of pollution to the marine environment comes from the land. One of the biggest sources is called nonpoint source pollution, which occurs as a result of runoff."
119,"From Wikipedia, the free encyclopedia. Agricultural pollution refers to biotic and abiotic byproducts of farming practices that result in contamination or degradation of the environment and surrounding ecosystems, and/or cause injury to humans and their economic interests. "
120,"Types and Effects of Pollutants. Agricultural water pollution can have variety of negative effects. Not only do substantial environmental problems result, but many of the pollutants produced by farms (minerals, chemicals and pathogens, to name a few) can make water unsafe for human consumption. Case in Point: Fish Kills. In the 2000 National Water Quality Inventory conducted by the Environmental Protection Agency (EPA), agricultural activity was identified as a source of pollution for 48% of stream and river water, and for 41% of lake water."
121,"Nonpoint source pollution can make river and ocean water unsafe for humans and wildlife. In some areas, this pollution is so bad that it causes beaches to be closed after rainstorms. More than one-third of the shellfish-growing waters of the United States are adversely affected by coastal pollution. Eighty percent of pollution to the marine environment comes from the land. One of the biggest sources is called nonpoint source pollution, which occurs as a result of runoff."
122,Agriculture is one of the main sources of diffuse water pollution. It is only by working with landowners and farmers to ensure management of the land in a way that is sensitive to the ecological health of the water environment that we will reduce this pressure. 
123,"Pollutants Damaging to Agriculture. Soil and water pollutants that adversely affect agriculture include sediment, out of place plant nutrients, inorganic salts and minerals, organic wastes, infectious agents, industrial and agricultural chemicals, and heat. For more than a century air pollution has affected agriculture. Burning coal and petroleum produces poisonous sulfur oxides. Fluorides result from mining, smelting and glass and ceramic manufacture."
124,"And as far as taking this product to lose weight, you have to size it up against other diet products on the market and see how it compares. The Claim. Plexus Slim claims that their products offer a safe way for you to lose weight. They also state that they can help you regular your blood sugar levels, and also help to keep your blood pressure at a healthy level. Overview. In this economy, we’re all looking for ways to get ahead, and network marketing might sound appealing to you. They claim that it is a business model that thrives in a down economy. It’s true enough that people always want to lose weight, no matter what the economy is doing."
125,"Many health products are sold this way, and it’s either something that you will appreciate because it’s like having your own consultant when you buy the product, or it’s something you will shy away from because you just want to click the Order Now button but you can’t. Overview. In this economy, we’re all looking for ways to get ahead, and network marketing might sound appealing to you. They claim that it is a business model that thrives in a down economy. It’s true enough that people always want to lose weight, no matter what the economy is doing."
126,"It is made by the internationally known company, Plexus Worldwide, who manufacture a number of health and wellness supplements that are all marketed and sold through their website and ambassador representatives The website itself is very professional in appearance and informative. Plexus Slim Overview. Plexus Slim is a product that, as the name suggests, helps the user lose weight, safely and effectively."
127,"Plexus Slim is just one of their range of weight loss products which can be used alone or as part of a full weight loss program. Plexus Slim Overview. Plexus Slim is a product that, as the name suggests, helps the user lose weight, safely and effectively."
128,"Period. Plexus Slim is research and manufactured by Plexus Worldwide Inc .which is situated in Scottsdale, Arizona. The official site contrasts from most destinations, in that it’s to a greater extent an “organization leaflet” or catalogue site displaying their products to both potential buyers and system advertisers. Plexus starts from the inside out and is not magic. It does not work over night so don’t get discouraged like I did in the past. I love Plexus and will probably take it for the rest of my life. Good luck to you all."
129,Plexus works to bring down high blood pressure and sugar levels and it works better than you prescription medications at it but without all the side effects. But u wouldn’t take two diabetic medications because ur sugar would go too low thus the drug interaction you claim is not a drug interaction at all. Plexus Slim does such a good job of balancing blood sugar that people have actually reduced or eliminated their dependency on insulin! Coach Ronnie Cuevas (a coach at Gulfport High in LA) is one of them.
130,"Plexus Slim can be purchased at a cost of $84.95 per bag but consumers can also try a 7 day sample of the product for $24.95. Plexus Slim is also available as part of a weight loss combo pack and all orders have a full 60-day money back guarantee. Plexus Slim Overview. Plexus Slim is a product that, as the name suggests, helps the user lose weight, safely and effectively."
131,"Plexus Slim is a powdered dietary supplement that is mixed with water to help you burn calories and fat while on the go. It contains no caffeine or stimulants and is meant to be used in conjunction with a regular diet plan. Plexus Slim also claims to help you obtain healthy blood sugar, cholesterol and lipid levels and is considered safe for those with diabetes."
132,Losing weight can be a daunting task with all the tempting food you can find everywhere. Many turn to the use of slimming products to achieve their ideal weight. Plexus Slim is one of these products that claims to help a person lose weight the natural way. 
133,"Despite the many positive characteristics of biofuels, there are also many disadvantages to these energy sources. 1  Energy output: Biofuels have a lower energy output than traditional fuels and therefore require greater quantities to be consumed in order to produce the same energy level. Advantages. Costs may decrease when using biofuels. Biofuel advocates frequently point out the advantages of these plant-and animal-based fuels, such as: 1  Cost: Biofuels have the potential to be significantly less expensive than gasoline and other fossil fuels."
134,"A biofuel is a fuel that is produced through contemporary biological processes, such as agriculture and anaerobic digestion, rather than a fuel produced by geological processes such as those involved in the formation of fossil fuels, such as coal and petroleum, from prehistoric biological matter. Biodiesel can be used as a fuel for vehicles in its pure form, but it is usually used as a diesel additive to reduce levels of particulates, carbon monoxide, and hydrocarbons from diesel-powered vehicles. Biodiesel is produced from oils or fats using transesterification and is the most common biofuel in Europe."
135,"Biofuels are not 100% safe but they are much safer than fossil fuels. If you were to spill a large quantity of biofuel into a concentrated area, it would likely kill living organisms and contaminate surround soil or water. However, the scale of the impact would be orders of magnitude smaller than with fossil fuels. Availability of Biofuels. Unlike fossil fuels, biofuels are a renewable energy source. Because they are derived from crops that can be harvested annually, or in the case of algae monthly, biofuels are theoretically unlimited. Despite this surface appearance of unlimited availability, biofuels do have restrictions."
136,"Fuels that have been extracted from plants and crops are known as biofuels. Of these, the most commonly extracted and used one is Bioethanol or simply Ethanol and Biodiesel. It is blended with gasoline and can be used as an alternative fuel for your car. 3. Renewable: Most of the fossil fuels will expire and end up in smoke one day. Since most of the sources like manure, corn, switchgrass, soyabeans, waste from crops and plants are renewable and are not likely to run out any time soon, making the use of biofuels efficient in nature."
137,"Advantages of biofuels. Biofuels have several advantages over fossil fuels [fossil fuel: Fuel, such as coal, oil and natural gas, made from the remains of ancient plants and animals.] . For example, biofuels:"
138,"Since the term biofuel first entered the energy lexicon of the average consumer, there has been a steady stream of advancements to this technology. While public perceptions on biofuels may have changed over the years, quite a lot of interest in the pros and cons of this fuel source still remain. Advantages. Costs may decrease when using biofuels. Biofuel advocates frequently point out the advantages of these plant-and animal-based fuels, such as: 1  Cost: Biofuels have the potential to be significantly less expensive than gasoline and other fossil fuels."
139,"Though biofuels have a number of advantages over fossil fuels, their integration into the fuel supply chain has to be done with great care to ensure that their potential disadvantages are, if not eliminated, at least minimized. "
140,"Top 10 Advantages of Biofuels. More people are using biofuels as a way to save money and decrease their consumption of fossil fuels. Hemera/ Thinkstock. Jonathan Goodwin is an inventor of the sublime. In his workshop in Wichita, Ks., Goodwin has fashioned a red 2005 H3 Hummer into a supercar."
141,"Primary Advantages and Disadvantages of Biofuels. No fuel source is completely positive or completely negative. Consumers need to weigh the pros and cons of biofuels to determine whether they feel comfortable with this resource as an alternative to traditional fuels. Advantages. Costs may decrease when using biofuels. Biofuel advocates frequently point out the advantages of these plant-and animal-based fuels, such as: 1  Cost: Biofuels have the potential to be significantly less expensive than gasoline and other fossil fuels."
142,"Related articles: Replacement Windows, Exterior Door, Interior Door. 1  The price for a tubular skylight (without installation) starts around $150-$250 for a small, basic model to $500-$600 or more for a large, deluxe version. 1 The total cost for both labor and materials runs about $500-$1,300 for a standard fixed skylight; a venting skylight with several options (such as special glass, a remote control and built-in blinds) can be $1,200-$5,000, and large custom projects could cost more."
143,"1 A venting skylight (a section opens for ventilation) starts around $300-$600 for a manual version, and an electric option with a remote control can be $650-$1,000 or more, depending on size and style. 2  Blinds, shades or special treatments can add another $200-$300 or more. 1 The total cost for both labor and materials runs about $500-$1,300 for a standard fixed skylight; a venting skylight with several options (such as special glass, a remote control and built-in blinds) can be $1,200-$5,000, and large custom projects could cost more."
144,"The usual skylight size is 450 x 550mm and can be installed in roofs between 15 and 70 degrees from the horizontal. It is wood framed, clad in aluminum, double glazed to the same specification as the roof windows, top hung with a 3 position latch and all flashing's are included with full fitting instructions. A skylight is fitted in exactly the same way and can be used for the same reasons as a roof window (Not including a Means of Escape window) Its is also very useful when the cost, weight and size of a roof window is inappropriate."
145,"Summary: How to fit a roof window, Velux window and skylight. How to fit Skylight Windows including Velux windows and other Roof Windows. This DIY installation guide, with pictures and instructions, shows you how to install the roof windows of your choice from inside or outside. A skylight is fitted in exactly the same way and can be used for the same reasons as a roof window (Not including a Means of Escape window) Its is also very useful when the cost, weight and size of a roof window is inappropriate."
146,"Internet # 202844251. Installing VELUX Sun Tunnel tubular skylights is a great way to brighten any space with energy-efficient natural light. They are perfect for interior rooms like bathrooms, closets, and hallways."
147,Regular skylights range in cost from $60 per square foot to $100 per square foot for double-glazed glass skylights. A high-quality skylight installed with the factory flashing kit made especially for it will virtually eliminate the risk of leaking and water damage to the roof around the installation site. 
148,"1 The price for a tubular skylight (without installation) starts around $150-$250 for a small, basic model to $500-$600 or more for a large, deluxe version. 1 The total cost for both labor and materials runs about $500-$1,300 for a standard fixed skylight; a venting skylight with several options (such as special glass, a remote control and built-in blinds) can be $1,200-$5,000, and large custom projects could cost more."
149,"1 The cost of just the skylight (without installation) starts around $150-$250 for a fixed model (it doesn't open). 2  A venting skylight (a section opens for ventilation) starts around $300-$600 for a manual version, and an electric option with a remote control can be $650-$1,000 or more, depending on size and style. 1 The total cost for both labor and materials runs about $500-$1,300 for a standard fixed skylight; a venting skylight with several options (such as special glass, a remote control and built-in blinds) can be $1,200-$5,000, and large custom projects could cost more."
150,"If you have an older fixed skylight, upgrade to a Solar Powered “Fresh Air” Skylight and bring fresh air as well as natural light into your home for an average of just $100 more than a standard fixed skylight after tax credit eligibility. If you’re considering a replacement Manual “fresh Air” Skylight, you could upgrade to the Solar Powered “Fresh Air” Skylight and save about $140 after tax credit eligibility. * After tax credit eligibility * Solar powered Fresh Air Deck Mounted Skylight shown."
151,"Genes are not solely to blame for the cause of osteoporosis; there are other factors as well which can lead to osteoporosis. Osteoporosis is the loss of bone mass. For example, being deficient or not consuming enough calcium can contribute to loss of bone mass, which then contributes to osteoporosis. New genetic cause of osteoporosis found, rare gene identified. By: Bel Marra Health | Osteoporosis | Tuesday, September 15, 2015 - 17:30 PM. A rare gene – the EN1 gene – has been identified as a potential osteoporosis cause by researchers at McGill University. With the use of extensive genetic data from the UK10K project, the research team uncovered that a variant of the EN1 gene has a large effect on bone mineral density (BMD)"
152,"Role of genes in osteoporosis. The study of genes and how they relate to osteoporosis has been an area of study for a long time. Osteoporosis may be affected by many gene variants and how they interact with environmental factors. New genetic cause of osteoporosis found, rare gene identified. By: Bel Marra Health | Osteoporosis | Tuesday, September 15, 2015 - 17:30 PM. A rare gene – the EN1 gene – has been identified as a potential osteoporosis cause by researchers at McGill University. With the use of extensive genetic data from the UK10K project, the research team uncovered that a variant of the EN1 gene has a large effect on bone mineral density (BMD)"
153,"The risk of osteoporosis is influenced by many factors such as age, sex, diet, physical activity, medication use and menopausal status, but one of the most important clinical risk factors is a positive family history, underscoring the role of genetic factors in determining disease susceptibility. "
154,"As a common bone disease, osteoporosis increases the risk of bone fractures as bone mineral density decreases over time, making them frail. As the population continues to age, osteoporosis is becoming more prevalent. The UK10K measured genetic variants from 10,000 individuals in great detail. New genetic cause of osteoporosis found, rare gene identified. By: Bel Marra Health | Osteoporosis | Tuesday, September 15, 2015 - 17:30 PM. A rare gene – the EN1 gene – has been identified as a potential osteoporosis cause by researchers at McGill University. With the use of extensive genetic data from the UK10K project, the research team uncovered that a variant of the EN1 gene has a large effect on bone mineral density (BMD)"
155,"Juvenile primary osteoporosis is a skeletal disorder characterized by thinning of the bones (osteoporosis) that begins in childhood. Osteoporosis is caused by a shortage of calcium and other minerals in bones (decreased bone mineral density), which makes the bones brittle and prone to fracture. Many people with childhood-onset osteoporosis do not have a mutation in the LRP5 gene. (When its cause is unknown, the condition is often called idiopathic juvenile osteoporosis). It is likely that mutations in other genes that have not been identified are involved in this condition. Read more about"
156,"Mutations in the LRP5 gene can cause juvenile primary osteoporosis. This gene provides instructions for making a protein that participates in a chemical signaling pathway that affects the way cells and tissues develop. In particular, the LRP5 protein is involved in the regulation of bone mineral density. Many people with childhood-onset osteoporosis do not have a mutation in the LRP5 gene. (When its cause is unknown, the condition is often called idiopathic juvenile osteoporosis). It is likely that mutations in other genes that have not been identified are involved in this condition. Read more about"
157,"Osteoporosis is a common disease with a strong genetic component. In recent years, some progress has been made in understanding the genetic basis of osteoporosis. Genetic factors contribute to osteoporosis by influencing not only bone mineral density but also bone size, bone quality, and bone turnover. Meta-analysis has been used to define the role of several candidate genes in osteoporosis"
158,"Genes that cause monogenic bone diseases also contribute to regulation of bone mass in the normal population. Genome-wide association studies and functional genomics approaches have recently begun to apply to genetic studies of osteoporosis. In recent years, some progress has been made in understanding the genetic basis of osteoporosis. Genetic factors contribute to osteoporosis by influencing not only bone mineral density but also bone size, bone quality, and bone turnover."
159,"Defining Osteoporosis. Osteoporosis is a disease marked by reduced bone strength leading to an increased risk of fractures, or broken bones. Bone strength has two main features: bone mass (amount of bone) and bone quality. Osteoporosis is the major underlying cause of fractures in postmenopausal women and the elderly. Although low bone mass (or low bone density) plays an important role in determining a person's risk of osteoporosis, it is only one of many risk factors for fractures. Fracture risk results from a combination of bone-dependent and bone-independent factors."
160,"But as spiders are very difficult to farm, a great deal of effort has gone into producing spider silk by genetic engineering. There are major challenges in producing spider silk through genetic engineering. First, the repetitive modules of the spider silk gene [1] tends to become truncated in the transgenic host through recombination between repeated modules of the same gene. Second, the high content of glycine (43-45 %) puts an unusual burden on the translation machinery of the host cell [3]. "
161,"INTRODUCTION Silk is a protein fiber made by silk worms and is the only natural fiber that is a filament fiber. Originally, it was believed that an ancient Chinese princess was the first to discover the process for manufacturing silk fabric from the filament fiber produced by silk worms. "
162,"Benefits of Silk. Besides its luxurious softness and lustrous beauty, there are benefits of silk that other fabrics, whether natural or man-made, simply cannot match. These advantages of silk have rightly earned silk its reputation as the queen of fabrics. 1 An all-climate fabric, silk is warm and cozy in winter and comfortably cool when temperatures rise. 2  Its natural temperature-regulating properties give silk this paradoxical ability to cool and warm simultaneously. 3  Silk garments thus outperform other fabrics in both summer and winter."
163,"Making the world better, one answer at a time. Advantages-Good quality and it gets rid of asthma. Disadvantages-Its very expensive and your killing silk worms just to get a single silk thread. Transporting silk by sea instead of sending it west on the Silk Road was faster and cheaper. No tolls to pay or bandits to worry about. There was some danger from pirates and … storms, but nothing is perfect. After China was opened to foreign trade, ships were obviously a more economical means of transporting silk."
164,"1 Because of its natural protein structure, silk is the most hypoallergenic of all fabrics. 2  An all-climate fabric, silk is warm and cozy in winter and comfortably cool when temperatures rise. 3  Its natural temperature-regulating properties give silk this paradoxical ability to cool and warm simultaneously. 1 An all-climate fabric, silk is warm and cozy in winter and comfortably cool when temperatures rise. 2  Its natural temperature-regulating properties give silk this paradoxical ability to cool and warm simultaneously. 3  Silk garments thus outperform other fabrics in both summer and winter."
165,"Disadvantages of silk: -expensive-shows flaws-shows stains-doesn't conduct heat well-deteriotes from sunlight/moisture-sags-will turn yellow with age. 6 people found this useful. Edit. Share to: 1  Arachnid Advice: Keeping a Tarantula as a Pet Exotic pets are becoming more and more popular these days. Transporting silk by sea instead of sending it west on the Silk Road was faster and cheaper. No tolls to pay or bandits to worry about. There was some danger from pirates and … storms, but nothing is perfect. After China was opened to foreign trade, ships were obviously a more economical means of transporting silk."
166,"Silk is a fabric made from animal fiber generated by silkworms that spin it to build cocoons. Silk is generally used for clothing such as blouses, dresses and ties, but it can also be used to make sheets and curtains. It has a fine, elegant and delicate appearance, but as a fabric, it has several disadvantages."
167,"Delicacy. Although silk is valued for its delicacy, that same delicacy is considered a disadvantage of the fabric. Silk fades easily in direct sunlight, so a new garment dried outside can look old and worn. The fabric has a tendency to develop a yellow color over time and is particularly prone to perspiration stains. Silk is generally used for clothing such as blouses, dresses and ties, but it can also be used to make sheets and curtains. It has a fine, elegant and delicate appearance, but as a fabric, it has several disadvantages."
168,"Cost. Silk is one of the most expensive fabrics on the market. Compared to cotton or nylon, silk is pricey. Silk ties or silk sheets cost significantly more than cotton counterparts because of the fabric's elegant appearance and the difficulty in its manufacture. Silk is generally used for clothing such as blouses, dresses and ties, but it can also be used to make sheets and curtains. It has a fine, elegant and delicate appearance, but as a fabric, it has several disadvantages."
169,"Silk comes from several different insects, but the type of silk we wear is most often woven by the larvae of the Bombyx mori (mulberry silkworm) which is raised in captivity for production purposes. Silk is a versatile fabric that is used in many different types of clothing because of its many benefits. It is thought that since silk is a substance created during a protective period for silkworms, the cocoon-derived fabric protects against natural threats like allergens. Dust mites, fungus and various other growths tend to stay off of silk materials, keeping your bed or clothes more allergy free."
170,"Vegetative reproduction is a type of asexual reproduction found in plants where new individuals are formed without the production of seeds or spores by meiosis or syngamy. Fragmentation is a form of asexual reproduction where a new organism grows from a fragment of the parent. Each fragment develops into a mature, fully grown individual. Fragmentation is seen in many organisms such as animals (some annelid worms [Which ones?] , turbellarians and sea stars), fungi, and plants."
171,"Asexual reproduction requires only one parent. Since there is only one parent, there is no exchanging of genetic information, and the offspring are clones of the parent. Asexual reproduction in plants can occur in a variety of forms, including budding, vegetative propagation, and fragmentation."
